{
  "site": "example-site",
  "url": "https://example.com",
  "batch": "batch-01",
  "captured_at": "2026-04-01T00:00:00Z",
  "viewports": [
    "1440x900",
    "390x844"
  ],
  "assets": {
    "full_page_screenshots": [
      "screenshot-desktop-full.png",
      "screenshot-mobile-full.png"
    ],
    "above_the_fold_screenshots": [
      "screenshot-desktop-hero.png"
    ],
    "mobile_screenshots": [
      "screenshot-mobile-full.png"
    ],
    "dom_snapshot": "dom-notes.md",
    "visible_text_export": "visible-text.md"
  },
  "notes": {
    "section_notes": [
      "Describe major sections in order."
    ],
    "interaction_notes": [
      "Describe hover, click, and scroll behavior."
    ],
    "technology_hints": [
      "Record likely implementation hints with uncertainty if needed."
    ],
    "missing_evidence": [
      "List any evidence you could not collect."
    ]
  }
}
